{
  "containments" : [],
  "description" : "",
  "level" : "ASSET",
  "name" : "CHLORINATION",
  "variables" : 
  [
    {
      "dataType" : "numeric",
      "description" : "",
      "euName" : "mg/l",
      "mandatory" : true,
      "name" : "CHLORINEPV",
      "variableType" : "dynamic"
    },
    {
      "dataType" : "numeric",
      "description" : "",
      "euName" : "mg/l",
      "mandatory" : true,
      "name" : "CHLORINESP",
      "variableType" : "dynamic"
    }
  ]
}